{
  "bid_id": "bid_valid",
  "brand_agent_id": "brand_agent_valid",
  "context_id": "ctx_valid",
  "wallet_id": "wallet_valid",
  "pricing": {
    "cpx": "0.05",
    "cpc": "0.40",
    "currency": "USD",
    "preferred_pricing_model": "CPC"
  },
  "offer": {
    "creative_input": {
      "brand_name": "Wayne Enterprises",
      "product_name": "Wayne CRM",
      "descriptions": ["Secure CRM with Gotham-grade reliability."],
      "value_props": ["On-prem control", "AI follow-ups"],
      "resource_urls": ["https://wayne.example/crm"],
      "image_urls": ["https://cdn.example.com/wayne/crm.png"]
    }
  },
  "timestamp": "2025-03-01T12:00:01Z",
  "auth": {
    "nonce": "nonce_valid",
    "signature": "sig_valid_bid"
  }
}
